sq_orig	sq_mod
Të rekumenduom nd uratë gjith atyne , qi t a marrënë me e xgjedhunë .	Të rekumenduar në uratë gjithë atyre , që ta marrin për ta zgjedhur.
Vëllazënitë e dashunë e të feeshimitë bijtë e Krishtit !	Vëllezërit e dashur e të feshëm bijtë e Krishtit !
Disa herë tue kujtuom të vdierrëtë e gjith aqë të madh dam të shintesë fee , qi u baa ende po bahetë për gjithë ditë ndë gjuhu-tanë maa keq me dhuunë se ndoonjii tjetër dore gjindje përmbii dheet , e tue paam ashtu ende , se këta diesitë e letërorëtë e hollë , qi u vien n dore ashtu gjaakafshë me ndimuom , e lanë shkret e gjaa maa s po ndimonjënë , – maa s keshë tietër qish me baam , veçëse hina mbarë e mprapë , sido munda , shkrova mbë gjuhu-tanë maa parë do kapituj të Ditësë Gjyyqit , qi i gjeta shkruom atit shumë ncë ndeershim e ncë devotshim frat Paalit prej Hasi .	Disa herë duke kujtuar të vdjerrët e gjith aq të madh dëm të së shenjtës fe , që u bë edhe po bëhet për gjithë ditë në gjuhën tonë më keq me dhunë se ndonji tjetër dor gjindje përmbi dhe , e duke parë ashtu edhe, se këta dijetarët e letrarët e hollë , që u vjen ndore ashtu gjëkafshë për të ndimuar , e lanë shkretë e gjë më s'po ndihmojnë , – më s'kisha tietër ç'të bëja , veçse hyra  mbarë e prapë , sido munda , shkrova në gjuhën tonë më parë do kapituj të Ditës së Gjyyqit , që i gjeta të shkruara atit shumë të ndershëm e të devotshëm frat Palit prej Hasi .
Të ciitë ende me do të tjera të nçtuome disa herë tue i shkruom , kuur tue paam se ishnë për të madhe ndimë e fruj-të shpiirtit t atii populli e aqë maa tepërë të disa priftëne , qi dëshërojnë me i pasunë , hina për gjithë ditë kaa pak tue nçtuom .	Të cilët ende me do të tjerë të shtuar disa herë duke i shkruar , kur duke parë se ishin për të madhe ndihmë e fruj-të të shpirtit të atij populli e aq më tepër të disa priftërve , që dëshirojnë me i pasur, hyra për gjithë ditë nga pak duke shtuar.
Shkrova ende saa të tjera kafshë , saa mujta ncë tiera gjuhush tue i nkthyem mbë gjuhu-tanë .	Shkrova edhe sa të tjera gjëra, sa munda prej gjuhësh të tjera duke i kthyer në gjuhën tonë .
E ndeevonë , mbasi andej u daashë , erdhshë mbë Romë , ke ashtë gurra e gjallë e gjithë herëvet .	E më vonë , mbasi andej u ndava , erdha që Romë , që është gurra e gjallë e gjithë herëve .
Tue paam , se gjuha jonë asndoonjë letërë e të mpsuom s e kaa , me të ciit të mundeej ndërta mee u ndimuom feeja e Krishtit , zuna fiill mund aqë saa munda , nktheva këtë shinte Doktrinë gjuhet së lëtine mbë gjuhu-t arbëneshe – si për ndimët të atii populli ashtu ende me nxierrë pakëzë gjumënë e disave , qi pakmos gjithë të riitë e jetënë e vet e shkuonë ndë të mbrazëtë paa mos lanë ndoonjë të përmendunë të mirë mbas vetëhe .	Duke parë se gjuha jonë as ndonjë letër e të mësuar s'ka , me të cilat të mundej ndër ta të ndihmohej feja e Krishtit , zura fill me aq sa munda , ktheva këtë të shenjtë Doktrinë prej gjuhës latine në gjuhën arbëreshe – si për ndimët të atij populli ashtu edhe për të nxjerrë pakëz gjumin e disave , që pakmos gjithë të rinjtë jetën e vet e shkojnë në të zbrazët duke mos lënë ndonjë të përmendur të mirë mbas vetes .
Të ciinë ndoonëse me pak fëdigë mbasi e mbarova , m u baa kori , qi disa e dërgova , disa mbet këtu .	Të cilën ndonëse me pak fëdigë mbasi e mbarova , m'u bë kori , që disa e dërgova , disa mbeti këtu .
E ndevonë , kuur maa për ngee tue e vuum roe , për pak fjalë , qi më duknë , se s jesënë mirë , qish ndodhi , këha ndë një ças fienë e parë e hoqa , e vent-atë saaj shtampova tjetërënë maa mirë .	E më vonë , kur më për nge duke vënë re , për pak fjalë , që m'u dukën se s'jesën mirë , qysh ndodhi , këtu në një çast fletën e parë e hoqa , e në vend të saj shtypa tjetrën më mirë .
Praashtu mos u vinjë gjaa keq pr ata , përse mb atë herë disa tue qenë puna për të ngutunë , disa u tue qenë vetëmë e jo aqë vesht ndjerë nd anët , disa shtampatorëtë tue mos diijtunë gjuhunë , – mos mërekullonii aqë ndjerë nd anët ncë mangut , qi të gjeeni , po se ende kaqë ku kam mundunë me e mbaruom .	Kështu mos u vijë gjë keq për to, sepse atëherë disa duke qenë puna për të ngutur , disa unë duke qenë vetëm e jo aq vesht ndjerë në anët , disa shtypësit duke mos ditur gjuhën , – mos u mrekulloni aq ndjerë nd anët ncë mangut , që të gjeni , po se ende kaq ku kam ta mbaroj .
E tashti , tue mos dashunë maa tej me ngjatunë , jo tjetërë veçëse , – mbasi u jam porësitunë ndr ato shinte uratë , qi jemi detuor njani për tjetërit , – u rekumendonj e u porësit ashtu ende gjith atë popullë e kërshtënim , qi kini ndaj vetëhenë , e aqë maa tepërë ata , qi kini marrë përpara vetii e nzotunë posikuur bariu grigjnë me i ruojtunë ndër gjithë saa janë kafshë të shpiirtit , – ashtu qi ndeevonë u pr uratë-tuoj e për të madhet mëshërier të Tinëzot , e ju për të nzyyrmit e fëdigët e kujdes-taaj , e ata për të prunjëtit e obedienciet e ndimët të korpit , qi t u banjënë gjithë ncë bashku , a t a kishnjimë atë fat me u paam njani me tjetërit ndë parriisit e regjënii-të qiellet , ke ndaj engjiit e ndaj shintënit të lëvdojmë shintinë emënitë e tii për gjithë jetë-të jetësë .	E tashti , duke mos dashur më tej të zgjatem , jo tjetër veçse , – mbasi unë jam porositur ndër atë të shenjtë uratë , që jemi borxhlinj ndaj njëri-tjetrit , – u rekumendoj e u porosit ashtu edhe gjith atë popull e krishterim , që keni ndaj vetes , e aq më tepër ata , që keni marrë përpara vetes e nzotunë posi bariu grigjën për të ruajtur ndër gjithë sa janë gjëra të shpirtit , – ashtu që më vonë u për uratën tuaj e për të madhe mëshërier të Tinëzot , e ju për të nzyyrmit e lodhjen e kujdesin tuaj , e ata për të prunjëtit e obedienciet e ndimët të trupit, që të bëhen të gjithë së bashku , a ta kishim atë fat për t'u parë njëri me tjetrin në parajsë e mbretëri të qiellit , ke ndaj engjëllit e ndaj shenjtit të lëvdojmë shenjtin emrin e tij për gjithë jetë të jetës .
Amen , ashtu qoftë .	Amin , ashtu qoftë .
Prej Rome të 7. ditë ndë kallënduor ndë vietë-të Krishtit 1618 .	Prej Rome të 7-n ditë në kallnor të vitit 1618 të Krishtit .
Gaatii ndë gjithë shërbëtyrë , i prunjëti vëllai i zotëniisë saaj dom Pietrë Budi prej Gurit së Bardhë , vikari gjeneraal i Shurbiisë .	Gati në gjithë shërbim , i prunjëti vëllai i zotnisë suaj dom Pjetër Budi prej Gurit të Bardhë , vikari i përgjithshëm i Serbisë .
Doktrina tashti mbë këtë arrësye vuum e ndërequnë për ndimët e të mpsuomi-të t kërshtenëvet .	Doktrina tashti për këtë arsye vënë e ndrequr për ndihmën e mësimin e të krishterëve .
ti njaj mbramje , tue folë me gjakont të vet njanënë fjalë e tietërënë e aqë maa tepërë themelit së shintesë fee e jetet s amëshuome , për ndimët e të mpsuomit të tjerëvet pyeti një ncish maa të diijtëshiminë tue i thanë , se : A jee ti i kërshtenë ? – përse këjo ashtë themeli e kryetë e gjithë kafshëvet për të shelbuom .	Thotë , se prifti një mbrëmje , duke folur me dhjakun e vet njërën fjalë e tjetrën e aq më tepër themelit të së shenjtës fe e jetës së amshuar , për ndimën e mësimin e të tjerëve pyeti një syresh më të dijshmin duke i thanë , se : A je ti i krishterë ? – përse kjo është themeli e kryet e gjithë gjërave për të shëlbuar .
E dhjaku, që e dinte mirë arsyen , se si duhet të përgjigjej, bukur gojëplot mbet e i tha , se : Jam për hir të Krishtit mëshirëplotë , zotit tonë .	E gjakoni , qi mirë e diij arrësyenë , se si duhetë me j rresponduom , bukur gojëplot mbet e j tha , se : Jam për hiirt të Krishtit mëshëriershim , zotit tynë .
E prifti : Qish kafshë do me thanë i kërshtenë ?	E prifti : Çfarë do të thotë i krishterë ?
E dhjaku: I krishterë tjetër s'do të thotë veçse një , që me gjithë zemër e shpresë beson në fenë e shenjtë të Krishtit mëshirëplotë, zotit tonë .	E gjakoni : I kërshtenë tjetër s do me thanë veçëse një , qi me gjithë zemërë e shpëresë mbeson mbë shintet fee të Krishtit mëshëriershim , zotit tynë .
E prifti : A mun a diish ti , se ndë se mbahetë feeja e Krishtit ?	E prifti : A mund ta diish ti , se në se mbahet feja e Krishtit ?
E dhjaku : Mbahetë ndër dyy të tinëzshime , qi janë mbuluom ndëne të baamit të shintesë kryyq , së nciashit njana kallëzon , se Zotyynë i mëshëriershimi , tue qenë ndë tre vetë , ashtë nja i vetëmi .	E gjakoni : Mbahet ndër dy të fshehta , që janë mbuluar nën të bërit të kryqit të shenjtë , nga të cilat njëra kallëzon se Zoti ynë i mëshirshëm , duke qenë në tre veta , është një i vetëm .
E tjetëra ashtë t ardhunitë mbë këtë jetë e të leemitë e muundinë e mortnë e Krishtit mëshëriershim , zotit tynë .	E tjetra është të ardhurit në këtë jetë e të lindurit e mundin e mortin e Krishtit të mëshirshëm , zotit tonë .
E prifti : Pa më thuo , se : Mbë qish arrësye ndëgjonetë këja fjalë ‘ ndë tre vetë një i vetëmë Zotyynë ’ ?	E prifti : Pa më thuaj , se : Në ç'arsye kuptohet kjo fjalë ‘ në tre vetë një i vetëm Zoti ynë ’ ?
E gjakoni : Përse ndë Tenëzotnë ashtë një e vetëme zotënii , e njaj natyre i paadaam , maa ashtë ndë tre vetë , qi quhenë Ati e Biri e Shpiirti Shint .	E dhjaku: Sepse në Tënëzonë është një e vetme zotni , e një natyre i pandarë , po është në tre veta , që quhen Ati e Biri e Shpirti i Shenjtë .
E prifti : Doe të m a thoshnje këtë fjalë ende maa nçelë ? – ndë mos , ndoonee me qishdo shemëllëtyrë të kësaaj jete , veçëse qi të mundnjë ende maa mirë me e ndëgjuom , se si e mbë qish arrësye munë ndëgjonetë këjo ‘ ndë tre vetë një i vetëmë Zotyynë ’ .	E prifti : Do të ma thoshje këtë fjalë edhe më çelë ? – në mos , ndoonee me çdo shembëlltyrë të kësaj jete , veçse që të mundë edhe më mirë për ta kuptuar , se si e për ç'arsye mund të kuptohet kjo ‘ në tre veta një i vetëm Zoti ynë ’ .
E gjakoni për shemëllëtyrë mbet e j tha , se : Pakmos mbë këtë arrësye .	E dhjaku për shembëllëtyrë mbeti e i tha , se : Pakmos për këtë arsye .
Një herë nji i kërshtenë e një xhudhii tue kundrështuom njani me tjetërit , xhudhiu , posi i paafee qi ish , mbet e j tha , se : Si munë jeetë Ati e Biri e Shpiirti Shint një i vetëmë Zotyynë ?	Një herë një i krishterë e një hebre duke kundrështuar njëri-tjetrin , hebreu, si i pafe që ish , mbet e i tha , se : Si mund të jetë Ati e Biri e Shpirti i Shenjtë një i vetëm Zoti ynë ?
E aj i kërshteni , ndoonëse s ish aqi i diijtëshim , – thoshnje , se ndë një ças Shpiirti Shint j a shtiu ndë mend me j thanë , se : Si munë jeetë ujëtë e vdora e akulli të tre nja ?	E ai i krishteri , ndonëse s ish aq i dijshëm – të thuash, se në një çast Shpirti i Shenjtë ia shtiu ndër mend t'i thotë , se : Si mund të jetë ujët e bora e akulli të tre një ?
Për të ciit fjalë me arrësye xhudhiu mbet sikuur ngatërruom e maa s qe i zoti as me j rresponduom .	Për të cilat fjalë me arsye hebreu mbeti si i ngatërruar e më s'qe i zoti as t'i përgjigjej .
Ashtu ende u tyy tashti s jam i zoti maa t afërë tjetër shemëllëtyrë me të dhanë jashtë këncoje – ndo anco cë diellit , qi i dha aj mjeshtri mb atë herë atii shërbëtorit vet , qi e pyeti , tue i thanë , se : Posikundrëse dielli tue qenë nja i vetëmi kaa ndë vetëhe dritënë e të nxeetitë , gjithë njaj natyre të paadaam , – ashtu ende Ati i qiellet tue qenë nja i vetëmi kaa ende Biirrë e Shpiirtinë Shint , të tre një i vetëmë Zotyynë e njaj natyre të paadaam .	Ashtu edhe unë ty tashti s jam i zoti më t afërë tjetër shembëlltyrë të të jap jashtë këncoje – ndo aso së diellit , që i dha ai mjeshtri atë herë atij shërbëtorit të vet , që e pyeti duke i thënë se : Posikundërse dielli duke qenë një i vetëm ka në vete dritën e të nxehtit , gjithë një natyre të pandaarë , – ashtu edhe Ati i qiellit duke qenë një i vetëm ka edhe birin e Shpirtin e Shenjtë , të tre një i vetëm Zoti ynë e një natyre të pandarë .
Këjo pak e shumë mun epetë për shemëllëtyre e jo maa tjetër .	Kjo pak a shumë mund të jepet si shembull e jo më tjetër .
Përse ku munë gjindetë krautyrë , qi të mundeej me u shëmënjyem me kriijuosit ?	Përse ku mund të  gjendet krijesë , që të të ngjajë me krijuesit ?
Oo kaha t ish ardhunë j atilli dies e letëruor gjith aqi i hollë , qi të mundënte njëmijë pjesësh një me e kallëzuom gjith aqii ncë randi e ncë madhejet zotëniet së tii ?	O nga të ish ardhur i atillë i ditur e letrar gjithë aq i hollë , që të mundte një mijë pjesësh një për të kallëzuar gjithë aq së rëndi e së madheje zotnisë së tij ?
Oo ku të munë gjindiishnë syytë e korpit gjith aqë të kthjellëtë e të dëlirë , qi të mundnjinë t atiinë perëndii me e paam ? – të ciinë thotë , se aqii drite ncë madhe saa aty e eengjiitë dëshëronjënë dërejt ndë faqet me e shukuom .	Oo ku të mund të gjendeshin sytë e trupit gjithaq të kthjellët e të dëlirë , që të mundë të atin për ta parë ? – të cilin thotë , se aq drite së madhe sa aty e engjëjt dëshirojnë drejt në faqe ta shikojë .
Po kush kaa pak oo shumë mend e shqise e të ndëgjuom ndë vetëhe , – mëjaft ashtë për nee e për të shelbuomit tanë , t a veemë roe e t a njofmë me syy-të mendet e të shpiirtit , tue e dashunë me gjithë zemërë e përmbii gjithë kafshët e tue shërbyem shintinë urdhënë e ligjnë e tii , jo ndryshej oo mbë qishdo tjetër arrësye po ashtu sikundrëse shinteja ama kishë katolike me drit-të Shpiirtit Shint e kaa urdhënuom e ndërequnë .	Po kush ka pak o shumë mend e shqisa e të kuptuar në vete , – mjaft është për ne e për të shëlbarit tanë , ta vëmë re e ta njohim me sy të mendjes e të shpiirtit , duke e dashur me gjithë zemër e përmbi gjithë gjërat e duke shërbyer të shenjtin urdhër e ligjin e tij , jo ndryshe o më qyshdo tjetër arsye po ashtu sikundërse shenjtja ama kishë katolike me dritë të Shpirtit të shenjtë e ka urdhënuar e ndrequr .
Përse na ndë dashimë posi shumë të tjerë me hipunë me këto të pyetuna e të çqyrëtime atje , ke s jemi të zotë me mbeerriim , aqii ncë nelt qi rrëzohemi e biemë , saa askuurraaj maa s jemi të zotë me u ngriijtunë .	Përse ne në daçim posi shumë të tjerë të hipim me këto të pyetura e shqyrtime atje , ku s'jemi të zotë të mbërrijmë , aq së lartiqi rrëzohemi e biem , sa askurrë më s jemi të zotë të ngriihemi .
Kush kaa veshëtë , kaqë mëjaft ashtë .	Kush ka veshë , kaq mjaft është .
Përse do kafshë , qi më pyet zotënia jote , s përkasënë kuujnaaj tjetëri me j diijtunë veçëse shintënet , qi janë mbë qiellt , e doktorëvet shintesë kishë , qi Shpiirti Shint kaa folë ende po flet për gojët të tyne – e jo muo e tyy , qi s jemi të zotë e të denjë as rrypnë e këpucësë tyne me u lidhunë e me u xgjidhunë .	Përse do gjëra, që më pyet zotnia jote , s'i përkasin kujt tjetër t'i dijë veçse shenjtëve, që janë në qiell , e doktorëve të kishës së shenjtë , që Shpirti i Shenjtë ka folë edhe po flet për gojë të tyre – e jo mua e ty , që s'jemi të zotë e të denjë as rripin e këpucës së tyne ta lidhin e ta zgjidhin .
E prifti mbet e j tha , se : Ajo ashtu ashtë mirëfilli e për të vërtetë .	E prifti mbeti e i tha , se : Ajo ashtu është mirëfilli e për të vërtetë .
Maa ende na paa mos folë e çqyrëtunjë gjaakafshë mbë këtë arrësye s jemi të zotë me e njofunë zemërënë e shqisenë e njani tjetërit .	Më edhe na pa mos fol e shqyrtuar gjëkafshë në këtë arsye s'jemi të zotë ta njohim zemrën e shqisën e njëri-tjetërit .
Praashtu pa më thuo , se : Mp sa oo për qish arrësye janë tre vetë ndë Tenëzotnë e ja tepërë oo mangu ?	Prandaj pa më thuaj , se : Mp sa o për ç'arsye janë tre vetë në Tenëzonë e jo tepër o mangët ?
E gjakoni : Përse Ati kaa qenë e ashtë i paa të zanë fiill e j paa meenguom kuurraaj për gjithë jetët-të jetësë e s vien tjetër ane , përse aj ashtë të zanëtë fiill , qi jet përmbii gjithë kafshët e ndër gjithë kafshët , e themeli i gjithë kafshëvet .	E dhjaku: Përse Ati ka qenë e është pazanë fil e i pamunguar kurrë për gjithë jetë të jetëve e s'vjen tjetër ane , përse ai është të zënët fill , që mbetet përmbi gjithë gjërat e ndër gjithë gjërat, e themeli i gjithë gjërave.
Maa Biri vjen prej Atit posikuur drita prej diellit ;	Pra Biri vjen prej Atit posikur drita prej diellit ;
e Shpiirti Shint vjen Atit e Birit posikuur të nxeetitë n djellit e dritet së tii .	e Shpirti i Shenjtë vjen prej Atit e Birit posikur të nxehtët prej diellit e dritës së tij .
E prifti përsërii : Pa me thuo , se : Mp sa e për qish arrësye këta të tre vetë janë një i vetëmë Zotyynë ?	E prifti përsëri : Pa më thuaj , se : Mp sa e për ç'arsye këta të tre vetë janë një i vetëm Zotynë ?
E gjakoni : Posikundrëse të thashë përsipëri , se janë të tre njaj natyre të paadaam – si ujëtë e vdora e akulli ndo dielli , të nxeetitë e drita e tii , – e kanë ncë bashku një të qenë e të mbetunë e puçtet e zotënii e një të dashunë e të mirë aqë të madh e të lëvduom , saa askuurraaj kandi s i dihetë , ashtu as gjuhet së n’jeriut s munë kallëzonetë .	E dhjaku: Po sikundërse të thashë më sipër , se janë të tre të një natyre të pandarë – si ujët e bora e akulli  ndo dielli , të nxehtët e drita e tij , –  e kanë së bashku një të qenë e të mbetur  e pushtet e zotni e një të dashur e të mirë aqë të madhe e të lëvduar , sa askurrkëndi s'i dihet , ashtu as me gjuhë të njeriut s'mund të kallëzohet .
E prifti : Pa më thuo , se : Qish kafshë shëmënjen e do me thanë këta të sdripunë të Krishtit e të marrëtë korp e të përziemitë e tii me këtë natyrë tanë e gjithë aqë muund e mortnë e tii përmbii dheet ?	E prifti : Pa më thuaj , se : Ç'gjë shembëllen e do të thotë ky të zbritur i Krishtit e të marrëtë trup e të përzierit e tij me këtë natyrë tonën e gjithaq mund e mortin e tij përmbi dhe ?
E gjakoni : Këjo , kush kaa pak oo shumë mend e shqise ndë vetëhe , tjetër s do me thanë , veçëse na kallëzon nee , se nji i vetëmi i Biri i Tinëzot për ndimët e të shelbuomi-tanë sdripi n qiellshit e u baa n’jeerii , e mbasi triidhjetë e trii vjet eci përmbii dheet , tue na mpsuom ligjnë e feenë e shintinë ungjiill e tue baam aqë shinje e mërekullii , saa askuurraaj s ishnë gjegjunë as paam .	E dhjaku: Kjo , kush ka pak a shumë mend e shqisë në vete , tjetër s'do të thotë, veçse na kallëzon neve , se një i vetëm i Biri i Tinëzot për ndihmë e shëlbimin tonë sbritii nga qielli e u bë n’jeerii , e mbasi tridhjetë e tre vjet eci përmbi dhe , duke na mësuar ligjin e fenë e ungjillin e shenjtë e duke bërë aq shinje e mrekulli , sa askurrë s'ishin dëgjuar e parë .
Ndeevonë gjindja e helmuome e e paanjofunë për të mirat të baame e zuunë e e lidhnë e e munduonë e j dhanë një mort aqë t idhunë e të mëryeshime mbë druu-të kryqsë , saa përnjëherë tue lëshuom shpiirtinë dridhti e u tristuo gjithë rrethi i shekullit , e muri i tempiesë , qi nd atë mot ish kisha e Tinëzot , plasi përmjedis njanet anë e mp tjetërët , e dielli mb atë arrësye u nxii e vduor atë të lëvduomenë dritënë e vet , saa dita ndë mjesëditët u err e u baa posikuur natënë , e saa të vdekunë e korpëna shintënish u ngjaallë e u kallëzuonë shumëve , tue dëshmuom e tue thanë , se : Aj qe mirëfilli e për të vërtetë i Biri i Tinëzot .	Më vonë gjindja e helmuar e e panjohur për të mirat e bëra e zunë e e lidhën e e munduan e i dhanë një mort aq të  hidhur e të habitshëm në dru të kryqit , sa përnjëherë duke lëshuar shpirtin dridhti e u trishtua gjithë rrethi i shekullit , e muri i tempullit , që në atë mot ish kisha e Tinëzot , plasi përmidis njërës anë e më tjetrën , e dielli për atë arsye u nxi e vdori atë të lëvduar dritën e vet , sa dita në mesditë u err e u bë posikur natë , e sa të vdekur e trupa shenjtësh u ngjallën e u kallëzuan shumëve , duke dëshmuar e duke thënë , se : Ai që mirëfilli e për të vërtetë i Biri i Tinëzot .
E këtë kafshë s e bani për tjetër veçëse për nee fajëtorët , përse qi mb atë arrësye me na çpërbleem me të paaçmuomit gjak të vet e me na lëshuom anci sënxhiri ncë helmuom , ndë të ciit qemë raam , e detyre nc atii mpkati , qi baanë printë e parë ndë parriisit , për të ciit me të madh helm e t idunë qenë vduom e qitunë jashtë hirit së Tinëzot e lavdit së parriisit , – sikundrëse ata ashtu ende gjithë të ndjekunitë e gjëniisë tyne ndeevonë maa se për pesë mijë vjet , ndjerë mos erdh Krishti mbë shekullit .	E këtë gjë s'e bëri për tjetër veçse për ne fajtorët , përse që për atë arsye të na shpërblejë me të paçmuarit gjak të vet e për të na lëshuar anci sënxhiri të helmuar , në të cilin kishim rënë , e detyre së atij mëkati , qe bënë prindët e parë në parajsë , për të cilët me të madh helm e hidhërim qenë humbur e qitur jashtë hirit të Tinëzot e lavdit të parajsës , – sikundërse ata ashtu edhe gjithë të ndjekurit e gjinisë së tyre më pas më se për pesë mijë vjet , deri mos erdhi Krishti në botë.
Përse thotë , se aj mpkati i tyne mb atë herë aqi i randë e j madh qi duku përpara Tinëzot , saa askuurraaj mbë ndoonjë tjetër arrësye mëngjii s mujti me gjetunë ,  ndjerë mos sdripi j atilli mjeek prej qiellshit t atiinë plagë e të keqe me e shëndoshunë e me e çpërbleem shekullinë .	Përse thotë , se ai mëkati i tyre atëherë aqi i rëndë e i madh që u duk përpara Tinëzot , sa askurrë më ndonjë tjetër arsye mëngji s'mundi të gjente , derisa të mos zbresë i atillë mjek prej qiellit të atillë plagë e të keqe për ta shëndoshur e për ta shpërblyer botën.
me gjithë aqë mundime e gjakt të vet të paaçmuomit .	me gjithaq mundime e gjak të vet të të paçmuarit .
E prifti mbet e j tha , se : Pa më thuo , se si oo mbë qish arrësye janë mbuluom këto të dyy të tinëzshime ndënë të baamit të shintesë kryq ?	E prifti mbet e i tha , se : Pa më thuaj ,  se si o për ç'arsye janë mbuluar këto të dy të tinëzshime nën të bërit të kryqit të shenjtë ?
E gjakoni : Përse të shinjifikuomitë e shintesë kryq banetë mbë këte arrësye , tue vuum maa parë m ballë dorënë e djathë e tue thanë , se : pr emënit të Atit – ani mbë zemërë tue thanë : e Birit – e ndeevonë përnjëherë tue prekunë buzënë e krahit shtëmangtë e mbë të djathët e tue thanë : e Shpiirtit .  Amen .	E dhjaku: Përse të shinjifikuomitë e kryqit të shenjtë bëhet për këtë arsye , duke vënë më parë në ballë dorën e djathtë e duke thënë , se : për emër të Atit – pastaj mbi zemër duke thanë : e Birit – e pastaj përnjëherë duke prekur buzën e krahut  të majtë e më të djathtë e duke thënë : e Shpirtit . Amin .
E prifti : Pa më thuo , se : Me qish arrësye këjo fjalë e shëmënjen të Shëndriitatnë ?	E prifti : Pa më thuaj , se : Për ç'arsye kjo fjalë e shëmënjen të Shëndriitatnë ?
E gjakoni : Përse këjo fjala e parë , qi thotë : pr emënit të Atit – këjo shëmënjen një të vetëminë zot bashkë me këto të dyy të tjerat , qi thotë : e Birit e Shpiirtit Shint – shëmënjenjënë të Shëndriitatnë .	E dhjaku: Përse kjo fjala e parë , që thotë : për emër të Atit – kjo shëmënjen një të vetmin zot bashkë me këto të dy të tjerat , që thotë : e Birit e Shpirtit të Shenjtë – shëmënjenjënë të Shëndriitatnë .
E prifti : Pa më thuo gjaakafshë ende kënci kshillit së dyyjtë !	E prifti : Pa më thuaj gjëkafshë edhe kësi këshillit së dytë !
Maa parë se si e mbë qish arrësye duhenë me qenë shërbyem këto shinte sakramente .	Më parë se si e më qysh arsye duhen shërbyer këto të shenjta sakramente .
