sq_orig	sq_mod
Praashtu posikundrëse ata , qi e shërbenjënë ,  ashtu ende gjith ata , qi e përzaanë e e marrënë , – tue qenë këjo dera e kryetë e gjithë kafshësë për të shelbuom , duhetë qi të jeetë shërbyem e marrë me të madhe shpëresë e të prunjëtë e devocione , ashtu qi t u jeetë njanësë lagje ende tjetërësë për të madhe ndimë e dobii të shpiirtit .	Pra ashtu posikundërse ata , qe e shërbejnë , ashtu edhe gjithë ata , që e përzënë e e marrin , – duke qenë kjo dera e kryet e gjithë gjësë për të shelbuar , duhet që të jetë shërbyer e marrë me të madhe shpresë e të prunjëtë e devocione , ashtu që t'u jetë njërës lagje edhe tjetrës për të madhe ndihmë e dobi të shpirtit .
E ati i shpiirtit oo kushdo tjetër t a shërbenjë këtë shint sakrament , mirë duhetë t i dijë [ Svane: die ] e t i njoho , se të tjera janë kafshëtë necessarie prej Sinëzot urdhënuom për shërbëtyrët të këtii shinti sakramenti , posi ashtë materia , forma , minister – e të tjera janë ato , qi përkasënë t atiillt gazimendi e ngushëllimi t paasosuni , posikundrëse ashtë zakoni e çerimonietë , të ciatë qysh moti shintitë apostuj me saa të denja e të dërejta arrësenje i kanë urdhënuom e ndërequnë ;	E ati i shpirtit o kushdo tjetër ta shërbenjë këtë të shenjtë sakrament , mirë duhet t'i dijë [ Svane: die ] e t'i njohë , se të tjera janë gjërat necessarie prej Sinëzot urdhëruar për shërbesë të këtij të shenjti sakrament  , posi është materia , forma , minister – e të tjera janë ato , që i përkasin të atillë gazmendi e ngushëllimi të pasosur , posikundërse është zakoni e ceremonitë , të cilat qysh moti të shenjtët apostuj me sa të denja e të drejta arrësenje i kanë urdhëruar e ndrequr ;
të ciatë aspak me ndoonjë arrësye s duhetë me qenë shkuom e lanë , veçëse ndë goditë ashtu ndoonja aqë e madhe nevojë , qi maa të mos kietë si me e baam .	të cilat aspak me ndonjë arsye s duhet të shkojnë e të lihen , veçse në godittë ashtu ndonjë aq e madhe nevojë , që më të mos ketë si ta bëjë .
Praashtu tashti këtu kënco kafshësh desha me folë e mirë me u a shtiim ndë mend , qi kyy shint sakrament , sikundrëse ashtë zakoni , bukur hieshim e me saa të dërejta arrësenje të jeetë shërbyem e ndeerunë : posikuur të zanëtë fiill të shintesë fee e kryetë e gjithë kafshëvet për të shelbuom .	Pra ashtu tashti këtu këso gjërash desha të flas e mirë për t'ua shtirë në mend , që ky i shenjtë sakrament , sikundërse është zakoni , bukur hieshëm e me sa të drejta arsye të jetë shërbyer e nderuar : posikur të zënët fill të së shenjtës fe e kryet e gjithë gjërave për të shëlbuar .
Maa parë materiet .	Më parë materiet .
Maa parë mirë t a njoho e t a dijë prifti , qi përzihetë nde këtë shinte shërbëtyre , se materia e këtii shinti sakramenti tjetër s ashtë veçëse ujetë e bukur e të kulluom paa ndoonjë tjetër të përzienë ndë vetëhe , veçëse ashtu sikundrëse ashtë dhanë Sinëzot .	Më parë mirë ta njohë e ta dijë prifti , që përzihet në këtë të shenjtë shenjtë shërbesë , se materia e këtij të shenjti sakrament tjetër s'është veçse uji i bukur e i kulluar pa ndonjë tjetër të përzier në vete , veçse ashtu sikundërse është dhënë Sinëzot .
Maa ujëtë e atii t pagëzuomi , qi banetë me solemnità , sikuur thuose gëzuoshim e me kumëtrë e me ndrikullë ndë kishë-të Tinëzot , – ata ujë duhetë me qenë maa pare beekuom të shëtunë e madhe oo të shëtunë e rshajevet , posikundrëse ashtë zakoni , e ruojtunë ndë fontë-të parequome for-të mpastrë e të dëlirë , si do ligja e Krishtit , ashtu qi të jeetë ndë gjithë vjetët e gjithëherë gaatii , aty e vien moti e koha me beekuom tjetërinë ;	Por ujët e atij të pagëzuari , që bëhet me solemnità , sikur thuase gëzuashim e me kumtër e me ndrikullë në kishë të Tinëzot , – ai ujë duhet të jetë më parë bekuar të shtunën e madhe o të shtunën e rrëshajëve , posikundërse është zakoni , i ruajtur në pagëzore të parequome fort të pastër  e të dëlirë , si do ligji i Krishtit , ashtu që të jetë në gjithë vjetët e gjithherë gati , aty e vjen moti e koha për ta bekuar tjetrin ;
e mb atë herë qish të jeetë tepëruom , duhetë me qenë shtiim ndë fontët të madhe të baptisterit , ke të jeetë vendi trajtuom , oo kund mbë qishdo tietër ven-të dëlirë ndë kishë-të Tinëzot .	e më atë herë qysh të jetë tepruar , duhet të jetë shtirë në pagëzore të madhe të baptisterit , ku të jetë vendi trajtuar , o kund më qyshdo tjetër vend të dëlirë në kishë të Tinëzot .
E mb atë herë , kuur të shoho , se ndë vjetët mer me menguom , aty mun i nçtonjë pakëzë tjetër ujë , qi të mos e lanë të thahetë , – maa jo shumë , po pakëzë .	E më atë herë , kur të shohë , se në vjetët merr të mungojë , aty mund t'i shtojë pakëz tjetër ujë , që të mos e lërë të thahet , – por jo shumë , po pakëz .
Maa mb atë herë , kuur t ish derdhunë paa hiir oo marrë eerë e çartunë oo mbë qishdo tietër arrësye meenguom , aty prifti përsërii , mbasi t a kietë bukur laam e dëliirm fontënë , t a mbushnjë përsërii me ujë të bukurë e të kulluom , ani të zanë fiill t a beekonjë , posikundrëse ashtë këtu vuum për fundit .	Por më atë herë , kur të ish derdhur pa hir o marrë erë e çartur o më qyshdo tjetër arsye mangët , aty prifti përsëri , mbasi ta ketë bukur larë e dëlirë pagëzoren , ta mbushë përsëri me ujë të bukur e të kulluar , ani të zërë fill ta bekojë , posikundërse është këtu vënë për fundi .
E mb atë herë , kuur sheh , se ujëtë e fontësë kaa ngriim e baam akullë , aty mun a çkriinjë me pak tjetër ujë të nxeetë , ashtu si të mundnjë me mbaruom zyrënë e oficienë e vet me arrësye e të mos venë foshnjënë m perikullë .	E më atë herë , kur sheh , se ujët e pagëzores ka ngrirë e bërë akull , aty mund ta shkrijë me pak tjetër ujë të nxehtë , ashtu si të mundë për të mbaruar detyrën e oficienë e vet me arsye e të mos vërë foshnjën më rrezik .
E ashtu ende e dyyjta kafshë n krye e këtii shinti sakramenti ashtë forma , – e cia s ashtë tjetër veçëse ato shinte fjalë , qi thotë prifti aty mb atë herë , kuur ndoonja tue pagëzuom përnjëherë tue i qitunë ujëtë majë kreesë jet e j thotë , se : Ego te baptizo in nomine Patris & Filii & Spiritus Sancti , – e këjo kshtu duhetë me u thanë gjithëherë , e jo ndryshej oo mbë tjetër arrësye e jo tjetër herej oo ndë tjetër koho , po mb atë herë , kuur për njëherë n kryq tue i shtiim ujëtë majë kreesë , sikundrëse ashtë zakoni i t pagëzuomit .	E ashtu edhe e dyta gjë në krye të këtij të shenjtë sakramenti është forma , – e cila s'është tjetër veçse ato të shenjta fjalë , që thotë prifti aty më atë herë , kur ndonjë duke pagëzuar përnjëherë duke i qitur ujët majë kryet rri e i thotë , se : Ego te baptizo in nomine Patris & Filii & Spiritus Sancti , – e kjo kështu duhet të thuhet gjithherë , e jo ndryshe o më tjetër arsye e jo tjetër herë o në tjetër kohë , po më atë herë , kur përnjëherë  në kryq duke i shtirë ujët majë kryet , sikundërse është zakoni i të pagëzuarit .
E mirë se këjo fjalë munë dishqaaronetë me u thanë mbë tjetër gjuhë , asgjaamangu prifti i lëtinë e j arbëneshë aspak s duhetë ndryshej me e nkthyem as me e ndërruom , po ashtu për letërë , sikundrëse ashtë shkruom e urdhënuom .	E mirë se kjo fjalë mund të dishqaaronetë për t'u thënë më tjetër gjuhë , asgjëmangu prifti i latin e i arbëresh aspak s'duhet ndryshej ta kthejë as ta ndërrojë , po ashtu për letër , sikundërse është shkruar e urdhëruar .
E këta shin-të pagëzuom si të jeetë baam një herë , aspak për së dyyjtë maa s munë përtërihetë , veçëse ndë qoftë ashtu ndoonjë të menduom , qi të mos diheej mirë , se a munë jeetë pagëzuom oo jo ;	E këta të shenjtë të pagëzuar si të jetë bërë një herë , aspak për së dytë më s'mund të përtërihet , veçse në qoftë ashtu ndonjë të menduar , që të mos dihej mirë , se a mund të jetë pagëzuar o jo ;
të këtiitë mbë këtë arrësye ke gjindenë , me këtë kondicione duhetë me i pagëzuom mbas gjithë kafshëshit së tjëra , tue i shtiim ujëtë përmbii krye , këtë fjalë mbë këtë arrësye me j a thanë , se : Si non es baptizatus , ego te baptizo in nomine Patris & Filii & Spiritus Sancti . E kshtu , ndë mos qe pagëzuom , me kaqë kish me qenë pagëzuom e ndë numuri-të kërshtenëvet .	të këtillët më këtë arsye ku gjenden , me këtë kondicione duhet të pagëzohen mbas gjithë gjërash të tjera , duke i shtirë ujët përmbi krye , këtë fjalë më këtë arsye për t'ia thënë , se : Si non es baptizatus , ego te baptizo in nomine Patris & Filii & Spiritus Sancti . E kështu , në mos qe pagëzuar , me kaq do të kish qenë pagëzuar e në numer të të krishterëve .
E thotë , se këta shin-të pagëzuom , posikundrëse ke ashtë zakoni , duhetë me qenë baam oo me të qituni- të ujit përmbii krye , posikundrëse thashë përsipëri , oo me të lagunit e të qituni-të gjithë korpit nd ujët ;	E thotë , se këta të shenjtë të pagëzuar , posikundërse ku është zakoni , duhet të jetë bërë o me të qitur  të ujit përmbi krye , posikundërse thashë përsipër , o me të lagurit e të qiturit të gjithë trupit në ujë ;
e këto të dya mëjaft janë , sikundrëse ke a zakoni , oo trii herë n kryq tue i qitunë ujë permbii krye oo n kryq tue e lagunë gjithë nd ujët , përnjëherë tue i thanë këto shinte fjalë të formësë , qi thamë përsipëri , – aj mb atë arrësye ashtë pagëzuom .	e këto të dyja mëjaft janë , sikundërse ku është zakoni , o tri herë në kryq duke i qitur ujë përmbi krye o në kryq duke e lagur gjithë në ujë , përnjëherë duke i thënë këto të shenjta fjalë të formës , që thamë përsipër , – ai më atë arsye është pagëzuar .
E aty ke bahetë pagëzimi me të shtiimi-të ujit , for-të ruhetë , qi ata ujë mos nkthenjë përsërii me raam nd ujë- të fontësë , po ndë tjetërët fontë të baptisterit ndaj ata trajtuom , oo ndë qishdo tietër anë pr atë shërbëtyrë ndërequnë , e ndeevonë oo shtiim ndë sakrariet oo mbë tjetër vend pr atë arrësye parequom .	E aty ku  bëhet pagëzimi me të shtirë të ujit , fort të ruhet , qq ata ujë të mos kthejë përsëri për të rënë në ujë të pagëzores , po në tjetër pagëzore të baptisterit ndaj ata trajtuar , o në qyshdo tjetër anë për atë shërbesë ndrequr , e më vonë o shtirë në sakrariet o më tjetër vend për atë arsye parequom .
E e treta kafshë n krye e këtii shinti sakramenti ashtë : minister , qi s ashtë tjetër veçëse prifti oo qishdo tjetër nd urdhënit shint prej nci co prej vikarit së vendit urdhënuom .	E e treta gjë në krye të këtij të shenjti sakrament është : minister , që s'është tjetër veçse prifti o kushdo tjetër në urdhrin e shenjtë prej nci co prej vikarit të vendit urdhëruar .
E këjo ndëgjonetë mb atë herë , kuur duketë , se s ashtë ndoonjë nevojë .	E kjo kuptohet më atë herë , kur duket , se s'është ndonjë nevojë .
Maa kuur t ish ashtu nevoja , sikuur thuose foshnja m perikullë me shkuom paa pagëzuom , – aty gjithëkush kaa të lirë e mundën me e pagëzuom , sidota e mbë qishdo gjuhu të jeetë , oo prift oo gjakon oo sekulaar , e se makaar t ish ndoonji i skomunikuom oo i pëganë e j paafee , oo burrë oo gruo të jeetë , – veçëse të diij e t ish i zoti me shërbyem materienë e formënë , qi thamë përsipëri , tue pasunë ndë mend me mbaruom , qish kisha shinte kaa urdhënuom .	Po kur të jetë ashtu nevoja , sikur thuase foshnja më rrezik të shkojë pa pagëzuar , – aty gjithkush ka të lirë e mund ta pagëzojë , si do ta e më qyshdo gjuhë të jetë , o prift o dhjak o shekullar , e se makar t'ish ndonjë i skomunikuar o pagan e i pafe , o burrë o grua të jetë , – veçse të dijë e të jetë i zoti të shërbejë materien e formën , që thamë përsipër , duke pasur në mend për të mbaruar , qysh kisha e shenjtë ka urdhëruar .
Maa thotë , se , ke gjindetë prifti , aty gjakoni s duhetë me pagëzuom ;	Por thotë , se , ku gjendet prifti , aty dhjaku s'duhet të pagëzojë ;
e ashtu ende , ke gjindetë gjakoni , ndoonjë sekulaar ;	e ashtu edhe , ku gjendet dhjaku , ndonjë shekullar ;
oo ke gjindetë burrë , aty gruoja s duhetë me pagëzuom – veçëse ndë qoftë kafsha aqii mbarreje mb atë herë , kuur foshnja ashtë tue leem , e të mos mundetë aty burrë me u afruom , oo mb atë herë , kuur gruoja ashtë maa vesht e e di maa mirë materienë e formënë me fjalët , qi thamë përsipëri , e ashtë e zotnja maa plot e maa mirë me e pagëzuom .	o ku gjindet burrë , aty gruaja s'duhet të pagëzojë – veçse në qoftë gjëja aq turp më atë herë , kur foshnja është duke lerë , e të mos mundet aty burrë të afrohet , o më atë herë , kur gruaja është më e zgjuar e di më mirë materien e formën me fjalët , që thamë përsipër , e është e zonja më plot e më mirë ta pagëzojë .
Prashtu thotë , se prifti gjithë kënco kafshësh duhetë fort me u nzyyrunë e me mpsuom popullinë e famulliinë e vet – e maa tepërë ato graa e plaka amëvisa , qi ndodhenë pakmos mbë gjithë vend , ke lindetë foshnja , – mirë tue u a shtiim ndë mend këtë kafshë , t a dijë [ Svane: die ] gjithëkush , ashtu qi , kuurdo të goditeej ashtu ndoonjë nevojë , të mos vdaareej ndoonjë paa pagëzuom për të paamsuom e të paadiijtunë .	Pra ashtu thotë , se prifti gjithë këso gjërash duhet fort të nzyyrunë e të mësojë popullin e famullinë  e vet – e më tepër ato gra e plaka amvisa , që ndodhen pakmos më gjithë vend , ku lindet foshnja , – mirë duke ua shtirë në mend këtë gjë, ta dijë [ Svane: die ] gjithkush , ashtu që , kurdo të goditet ashtu ndonjë nevojë , të mos humbet ndonjë pa pagëzuar për të pamësuar e të paditur .
E thotë , se j ati e e ama vetë fëmiinë e vet aspak s do ligja me e pagëzuom ;	E thotë , se i ati e e ama vetë fëmijën e vet aspak s'do ligji ta pagëzojnë ;
maa , kuur të shif ashtu ndoonjë nevojë , se foshnja po shkon paa pagëzuom , e kush tjetërë s gjindetë , aty maa si e ban s kaa , po i duhetë t a pagëzonjë paa lidhunë ndë ndoonjë kumëtrii oo të mbaajtunë gjaa pr ata njani me tjetërit .	po, kur të shohë ashtu ndonjë nevojë , se foshnja po shkon pa pagëzuar , e kush tjetër s'gjendet , aty më si t'ia bëjë s ka , po i duhet ta pagëzojë pa lidhur në ndonjë kumëtëri o të mbajtur gjë për ata njëri me tjetrin .
Saa moti e ndë qish koho duhetë foshnja me u pagëzuom .	Sa moti e në qysh kohë duhet foshnja të pagëzohet .
Duhetë prifti bukur t i msonjë popullinë e famulliinë e vet , qi , foshnja posaa leen , maa të parënë kafshë , aqë saa maa çpejt të mundnjënë , t a shpienë n kishët shinte t a pagëzonjënë , sikundrëse do ligja e Krishtit , e jo me vuum ree aqë ndierë nd anët do zakone , qi kanë mbë disa vise , tue e përciellë ditë mbë ditë , ndierë gjeen kuorrë e kohonë e kumëtritë e ndrikullatë , e ndierë ban gatii gostiinë e disa ashtu të tjera madhështii e kafshë të mbrazëta , aqë saa disa herë godit gjukata e keqe e tyne , e ashtu venë paa pagëzuom – mkat aqi i madh e j randë , saa gjuhet së nieriut askuurraaj s mundetë me u kallëzuom , ashtu as munë njëmendetë me ndoonjë tjetër mbë këtë jetë . Praashtu nçil syytë gjithekush , e , saa maa çpejt qi të mundnjësh , t i pagëzojsh paa vuum m perikullë të shelbuomitë e tyne ende të vetëvetëhesë .	Duhet prifti bukur t'i mësojë popullin e famullinë e vet , që , foshnja posa len , më të parën gjë, aq sa më shpejt të mundin , ta shpien në kishën e nsshenjtë ta pagëzojnë , sikundërse do ligja e Krishtit , e jo të vihet re aq deri në anët do zakone , që kanë më disa vise , dukee përcjellë ditë mbë ditë , deri gjer kurrë e kohën e kumtërit e ndrikullat , e deri bën gatii gostinë e disa ashtu të tjera madhështi e gjëra të zbrazëta , aq sa disa herë godit gjukata e keqe e tyre , e ashtu venë pa pagëzuar – mëkat aq i madh e i rëndë , sa gjuhe së njeriut askurrë s'mundet të kallëzohet , ashtu as mund të njëjtësohet me ndonjë tjetër më këtë jetë . Pra ashtu çil sytë gjithkush , e , sa më shpejt që të mundësh , t'i pagëzosh pa vënë në rrezik të shëlbuarit e tyre  edhe të vetvetes .
E mb atë herë , kuur godit kafsha për necessità e pagëzonjënë ndoonja ndë shtëpii për të çpejtë veçëse me formët e me të qituni-të ujit , posikundrëse kemi thanë përsipëri , – t atiinë , ndë qoftë gjaall , ndeevonë t a shpienë n kishë ke prifti , e t i banjë gjithë cerimoniatë e tjera jashtë formet e ncë qitunit së ujit , qi i qenë baam maa m pari ;	E më atë herë , kur godit gjëja për necessità e pagëzojnë ndonjë në shtëpi për të shpejtë veçse me formën e me të qitur të ujit , posikundërse kemi thënë përsipër , – t 'atillin , në qoftë gjallë , pastaj ta shpien në kishë te prifti , e t'i bëjë gjithë cerimonitë e tjera jështë forme e së qiturit të ujit , që i qenë bërë më  parë ;
oo , ndë qoftë ashtu ndoonjë dubitacione e të menduom për të paadiijtunit e të paavesht t atyne , qi e pagëzuonë , persërii tue i qitunë ujëtë , formënë të j a thoetë me atë kondicione , qi thamë përsipëri : Si non es baptizatus , ego te baptizo in nomine Patris &c.	o , në qoftë ashtu ndonjë dyshim e të menduar për të paditurit e të paavesht të atyre , qi e pagëzuan , përsëri duke i qitur ujët , formën t'ia thotë me atë kondicione , që thamë përsipër : Si non es baptizatus , ego te baptizo in nomine Patris &c.
E duhetë ashtu ende me diijtunë , se asndoonja , saa ashtë mbërshelë ndë bark-të s amësë , s munë pagëzonetë .	E duhet ashtu edhe ditur, se asndonjë , sa është mbyllur në bark të s'ëmës , s'mund të pagëzohet .
Maa mb atë herë , kuur duketë , se foshnja kaa qitunë veçëse kryetë jashtë e ashtë m perikulli-të mortsë , ajo aty mb atë arrësye munë pagëzonetë ;	Por më atë herë , kur duket , se foshnja ka qitur veçse kryet jështë e është më rrezik të mortit, ajo aty më atë arsye mund të pagëzohet ;
e ndeevonë , ndë qoftë gjaall , maa s kish me j u dashunë tjetër të pagëzuom veçëse ato uratë e çerimonietë e tjera , qi i mbetnë paa baam .	e më vonë , në qoftë gjallë , më s'kish t'i duhej tjetër të pagëzuar veçse ato uratë e ceremonitë e tjera , që i mbetën pa bërë .
E ndë mos pastë nxierrë kryetë , po qishdo tjetër gjymtyrë , qi të njifetë , se ashtë gjaall e m perikulli – të mortsë , aty mun a pagëzonjë nd atë gjymtyrë ;	E në mos pastë nxjerrë kryet , po qyshdo tjetër gjymtyrë , që të njihet , se është gjallë e në rrezik – të mortjes , aty mund ta pagëzojë në atë gjymtyrë ;
e ndeevonë , ndë leftë gjaall , përsërii me e pagëzuom me atë kondicione e arrësye , qi thamë përsipëri : Si non es baptizatus , ego te baptizo in nomine Patris &c.	e më vonë , në leftë gjallë , përsëri të pagëzohet me atë kondicione e arsye , që thamë përsipër : Si non es baptizatus , ego te baptizo in nomine Patris &c.
E ndë goditi kafsha , qi , mbasi e pagëzuonë nd atë gjymtyrë , leu vdekunë , ajo munë shtiiretë  ndë çemiteer-të kishësë , e jo ndryshej .	E në godittë gjëja, që , mbasi e pagëzuan n atë gjymtyrë , leu i vdekur , ajo mund të shtiret në qimitir të kishës , e jo ndryshe .
E ashtu ende thotë , se mb atë herë , kuur godit kori , qi vdes ndoonjë gruo e ngarkuome – ata , qi janë vesht , mb atë ças t a çkierrënë e të j a nxierrënë jashtë foshnjënë ;	E ashtu edhe thotë , se më atë herë , kur godit kori , që vdes ndonjë grua e ngarkuar – ata , që janë vesht , më atë ças ta çjerrin e t'ia nxierrin jështë foshnjën ;
e nd u ndieftë , se a gjaall , t a pagëzonjënë ;	e në u ndjeftë , se është gjallë , ta pagëzojnë ;
e ndë qoftë vdekunë , qi të mos munë pagëzonetë ;	e në qoftë vdekur , që të mos mund të pagëzohet ;
s do ligja me e shtiim mbë ven-të shekruom .	s'do ligji të shtihet më vend  të shenjtëruar.
E foshnja , qi të gjindeej çkitunë kund e të mos diheej , se oo ashtë pagëzuom oo jo , – t atinë duhetë me e pagëzuom me atë kondicione e arrësye , qi thashë përsipëri , se : Si non es baptizatus , ego te baptizo &c.	E foshnja , që të gjendej shqitur kund e të mos dihej , se o është pagëzuar o jo , – të atillin duhet ta pagëzojmë me atë kondicione e arsye , që thashë përsipër , se : Si non es baptizatus , ego te baptizo &c.
E mb atë herë , kuur godit kori e leen kund ndoonjë moshtrë e ashtu kafshë e shëmtuome , qi s dihetë , se mbë qish arrësye ashtë , – aty mb atë ças të gërshesënë nierëz të diijtëshim , qi t a shohonë , e , si t u duketë , ashtu të banjënë ;	E më atë herë , kur godit kori e len kund ndonjë monstër e ashtu gjë e shëmtuar , që s'dihet , se më qysh arsye është , – aty m atë ças të gërshasin njerëz të ditshëm , që ta shohin , e , si t'u duket , ashtu të bëjnë ;
përse thotë , se moshtra , qi as me ndoonjë shinj nukë shëmënjen me qenë nierii , ajo as me ndoonjë arrësye s munë pagëzonetë .	përse thotë , se monstra , që as me ndonjë shenjë nuk shembëllen të jetë njeri , ajo as me ndonjë arsye s mund të pagëzohet .
Pasëqyra e t rrëfyemit e atit Emerio de Bonis me saa tjera kafshë shumë të frujtuoshime të shpiirtit për ndimë të gjuhu- së arbëneshe e aqë maa tepërë për t atynet , qi s janë të zotë me ndëgjuom gjuhu ncë tjera letërash , nkthyem gjuhet së lëtine mbë gjuhu-t arbëneshe zotit dom Pietrë Budit prej Gurit së Bardhë , upeshkëpit së Zadrimësë .	Pasqyra e të rrëfyemit e atit Emerio de Bonis me sa të tjera gjëra shumë të frytshme të shpirtit për ndimë të gjuhës së arbëreshe e aq më tepër për të atyre , që s'janë të zotë të kuptojnë gjuhë të tjera letrash , kthyer gjuhës së latine më gjuhë të arbëreshe zotit dom Pietër Budit prej Gurit së Bardhë , ipeshkëvit të Zadrimës .
In Roma 1621 .	In Roma 1621 .
Të rekumenduom e të porësitunë upeshktipinjet e vikarinjet e gjithë saa tjerë prelate gjindenë ndë gjuhu-tanë t arbëneshe .	Të rekomanduar e të porositur ipeshkëve e vikarëve e gjithë sa tjerë prelatë gjenden në gjuhën tonë të arbëreshe .
Të ndritshimë e shumë të ndeershimë zotënii e shokë e vëllazënë !	Të ndritshëm e shumë të ndershëm zotërinj e shokë e vëllezër !
Tue dashunë me u nëkuom saa tentacionesh e fëdigësh , qi më kanë gjetunë mbë këtë udhë , druo , se kaa me dukunë kuujnaaj , se duo me u lëvduom .	Duke dashur të ankohem sa përpjekjesh e mundimesh , që më kanë gjetur më këtë udhë , druaj , se ka për t'iu dukur kuujt , se dua të lëvdohem .
E kuur të doe ashtu ende gjaakafshë me u lëvduom , kuur të thom të vërtetënë , – posi mb atë herë i shën Paali i beekuom korintianëvet , – thom , se s dii , a ka me qenë gjaa pr ata i paadiijtunë , mirë tue paam zotënia juoj , se jashtë këncosh ende saa të tjera letëra me dorë të shkruome gjindenë mbë saa vise , qi dëshmonjënë , se saa i madh kaa qenë gjithëherë kujdesi e dëshiri i zemërësë sime për ndimë të Patriesë e të gjuhusë sanë , qi u vduorrë ende po vdaarenë maa të shumënë veçëse për letërë e për të mpsuom .	E kur të dua ashtu edhe gjëkafshë të lëvdohem , kur të them të vërtetën , – posi më atë herë shën Pali i bekuar korintianëve , – them , se s'di , a ka për të qenë gjë për ata i paditur , mirë duke parë zotnia juaj , se jashtë kësosh edhe sa të tjera letra me dorë të shkruara gjenden më sa vise , që dëshmojnë , se sa i madh ka qenë gjithherë kujdesi e dëshira e zemrës sime për ndihmë të athdeut e të gjuhës sonë , që u vdor edhe po vdaret më të shumën veçse për letër e për të mësuar .
E ndeevonë , kuur maa tue paam , se dita qi vjen po maa keq shinteja fee ndër ta vjen tue menguom ;	E pastaj , kur më duke parë , se dita që vjen po më keq e shenjta fe ndër ta vjen duke munguar ;
e shërbëtyra e kishësë Tinëzot , me gjithë saa janë tjerat vepëra të mira , maa tue u shqimbunë e tue u harruom ;	e shërbesa e kishës së Tinëzot , me gjithë sa janë të tjerat vepra të mira , po duke u shqimur e duke u harruar ;
e mbas mortjet së pleqet të riitë maa i lanë gjurmëtë e Krishtit e të apostujet e vepëratë e t kërshtenëvet e u veshnë ndër të t pëganëvet e të t paafeevet ;	e mbas mortjet së pleqve të rinjtë më i lënë gjurmëtë e Krishtit e të apostujve e veprat e të krishterëve e u veshën ndër të të paganëve e të të pafeve ;
